{
  "schemaVersion": "1.0.0",
  "packId": "country.it.expenses",
  "country": "IT",
  "module": "expenses",
  "version": "2026.1.0",
  "lifecycleStatus": "regulatory_review",
  "effectiveFrom": "2026-01-01",
  "verifiedAt": "2026-07-20",
  "currency": "EUR",
  "languages": [
    "it",
    "en"
  ],
  "automaticPublication": false,
  "expense": {
    "allowedCategories": [
      "meal",
      "accommodation",
      "fuel",
      "toll",
      "parking",
      "train",
      "flight",
      "taxi",
      "ride_hailing",
      "public_transport",
      "vehicle_rental",
      "mileage",
      "per_diem",
      "telecommunications",
      "office_supplies",
      "representation",
      "training",
      "conference",
      "home_working",
      "miscellaneous"
    ],
    "receiptRequiredDefault": true,
    "evidenceRequirements": [
      "original_receipt",
      "business_purpose",
      "merchant",
      "expense_date",
      "payment_method"
    ],
    "rules": [
      {
        "id": "it.traceable.domestic.2026",
        "kind": "payment_traceability",
        "category": [
          "meal",
          "accommodation",
          "taxi",
          "ride_hailing"
        ],
        "effect": "deductible_only_if_traceable",
        "sourceIds": [
          "it-dl84"
        ],
        "conditions": {
          "expenseTerritory": "IT"
        },
        "requirements": [
          "traceablePayment"
        ]
      },
      {
        "id": "it.perdiem.domestic",
        "kind": "allowance_limit",
        "category": "per_diem",
        "effect": "employee_income_exemption_limit",
        "sourceIds": [
          "it-tuir"
        ],
        "conditions": {
          "tripScope": "domestic"
        },
        "limit": {
          "currency": "EUR",
          "amount": 46.48
        }
      },
      {
        "id": "it.perdiem.foreign",
        "kind": "allowance_limit",
        "category": "per_diem",
        "effect": "employee_income_exemption_limit",
        "sourceIds": [
          "it-tuir"
        ],
        "conditions": {
          "tripScope": "foreign"
        },
        "limit": {
          "currency": "EUR",
          "amount": 77.47
        }
      },
      {
        "id": "it.vat.meal.lodging",
        "kind": "vat_treatment",
        "category": [
          "meal",
          "accommodation"
        ],
        "effect": "manual_review",
        "sourceIds": [
          "it-vat"
        ],
        "requirements": [
          "invoiceToCompany"
        ]
      }
    ]
  },
  "retention": {
    "mode": "fixed_minimum",
    "minimumYears": 10,
    "requiresLegalReview": true
  },
  "sources": [
    {
      "id": "it-dl84",
      "authority": "Normattiva",
      "title": "DL 84/2025 traceable payments",
      "url": "https://www.normattiva.it/eli/id/2025/08/01/25A04376/ORIGINAL",
      "verifiedAt": "2026-07-20"
    },
    {
      "id": "it-tuir",
      "authority": "Normattiva",
      "title": "DPR 917/1986 TUIR article 51",
      "url": "https://www.normattiva.it/uri-res/N2Ls?urn:nir:stato:legge:1986;917~art51=",
      "verifiedAt": "2026-07-20"
    },
    {
      "id": "it-vat",
      "authority": "Agenzia Entrate",
      "title": "VAT meals and lodging",
      "url": "https://www.agenziaentrate.gov.it/",
      "verifiedAt": "2026-07-20"
    },
    {
      "id": "it-retention",
      "authority": "Agenzia Entrate",
      "title": "Electronic invoice retention",
      "url": "https://www1.agenziaentrate.gov.it/web_app_entrate/fatturazione_elettronica.html",
      "verifiedAt": "2026-07-20"
    }
  ],
  "unresolvedDecisions": [
    "VAT depends on invoice holder and business link"
  ],
  "governance": {
    "regulatoryApprovalRequired": true,
    "technicalApprovalRequired": true,
    "securityApprovalRequired": true
  }
}
